{
  "config_version": 1,
  "config_id": "d28fcdd9-0420-5d16-b938-29d8966666ec",
  "config_modified_utc": "2026-09-16T11:00:00Z",
  "output_directory": "E:\\_src\\ParquetToXL\\e2e\\destination",
  "sidecar_location": {
    "kind": "directory",
    "path": "E:\\_src\\ParquetToXL\\e2e\\sidecars\\dtypes_showcase"
  },
  "scratch_root": "E:\\_src\\ParquetToXL\\e2e\\scratch",
  "excel": {
    "writer": "rustpy-xlsxwriter",
    "options": {}
  },
  "sources": {
    "dtypes": {
      "path": "E:\\_src\\ParquetToXL\\e2e\\sources\\dtypes.parquet",
      "date_columns": {
        "booked": {
          "type": "date"
        }
      }
    }
  },
  "profiles": [
    {
      "name": "dtypes_showcase",
      "output_subdirectory": "dtypes_showcase",
      "limits": {
        "max_data_rows_per_worksheet": 1048575,
        "max_cells_per_workbook": 10000000
      },
      "partitioning": {
        "algorithm": "calendar_greedy",
        "base_period": "year-month",
        "period_order": "ascending",
        "year_split_months": [
          6,
          4,
          3,
          2,
          1
        ],
        "oversized_period": "balanced_rows",
        "null_dates": "separate"
      },
      "naming": {
        "workbook": "{profile}_{period_label}_{workbook_index:03d}.xlsx",
        "worksheet": "{source} {period_label}",
        "single_worksheet": "{source} Data",
        "overflow_worksheet": "{source} {period_label}_p{part_index:02d}",
        "month_format": "numeric",
        "worksheet_prefix": "",
        "sheet_collision": "error"
      },
      "sheets": [
        {
          "source": "dtypes",
          "partition_column": "booked",
          "sort": []
        }
      ]
    }
  ]
}